{
  "taskId": "33333333-3333-4333-8333-333333333333",
  "sessionId": "22222222-2222-4222-8222-222222222222",
  "worklineId": "00000000-0000-4000-8000-000000000003",
  "attemptId": "44444444-4444-4444-8444-444444444444",
  "runnerEpoch": 1,
  "status": "COMPLETED",
  "terminalReason": "ANSWER_DELIVERED",
  "answer": {
    "content": "这是合成样例，不是实机验收结果。",
    "answerEventId": "22222222-2222-4222-8222-222222222222:1:43",
    "modelResponseEventId": "22222222-2222-4222-8222-222222222222:1:42"
  },
  "progresses": [],
  "unpublishedChanges": null
}
